toolnaam,type,waarvoor,gebruikers,aantal_universiteiten,universiteiten_voorbeeld,in_literatuuronderzoek,literatuuronderzoek_toelichting,direct_bruikbaar_voor_team,kosten,data_en_privacy,link,github_link,in_top5,reden_selectie_of_afwijzing
Consensus,Literatuurreview,"Onderzoeksvragen beantwoorden via uitsluitend peer-reviewed bronnen. Evidence-score per bewering. Zoekt in 220M+ papers.","5M+","10.000+","Princeton, Stanford, Harvard, UCLA, Northwestern",Ja,"Gepubliceerd in PMC (2025). Geciteerd in bibliotheekgidsen van Oregon State / Ohio University / Oklahoma State. Universiteitsbrede abonnementen bij St. Thomas en St. Catherine University.",Ja,Gratis basisversie,"Institutionele contracten beschikbaar.",consensus.app,,Ja,"Sterkste universitaire adoptie. Zoekt alleen peer-reviewed — geen Wikipedia of blogs."
Elicit,Literatuurreview,"Literatuur zoeken, samenvatten en data extraheren op basis van onderzoeksvraag. 125M papers.","2M+","10+","Oregon State (betaald abo via bibliotheek), Ohio State, Arizona, Baylor, Deakin",Ja,"Geëvalueerd in PMC. Cochrane-recalls gepubliceerd: 95% zoeken / 97% abstract / 99% full-text. Oregon State en 4 andere universiteitsbibliotheken evalueerden de tool.",Ja,Gratis basisversie,"GDPR-compliant. Verwerkersovereenkomst beschikbaar. Data niet voor modeltraining.",elicit.com,,Ja,"Sterkst gevalideerde tool voor literatuurreview. Enige met gepubliceerde Cochrane-recall-scores."
Scite,Citatie-analyse,"Citaties classificeren als supporting, contrasting of mentioning. 1,6 miljard+ citaties geclassificeerd.","2M+","5+","Oregon State, University of Kansas, Clemson, Albert Einstein College of Medicine, University of Arizona",Ja,"Partner van 30+ wetenschappelijke uitgevers. Institutionele abonnementen bij 5+ universiteiten. Gepubliceerde evaluaties in bibliotheekjournals.",Ja,Gratis basisversie,"Institutionele contracten beschikbaar.",scite.ai,,Ja,"Unieke functie: context van citaties. Essentieel voor betrouwbaarheidsbeoordeling van claims."
ASReview,Screening systematic reviews,"Grote literatuurvolumes screenen voor systematische reviews via active learning AI. Versie 2.0 ondersteunt meerdere experts tegelijk.","Niet bekend","20+","Universiteit Utrecht (maker). Gebruikt bij NL en internationale onderzoeksinstellingen.",Ja,"Gepubliceerd in Nature Machine Intelligence (2021). Honderden systematische reviews citeren de tool. Open source (Apache 2.0).",Ja,Gratis,"Lokaal te draaien. Geen data naar externe servers.",asreview.nl,github.com/asreview/asreview,Ja,"Enige tool op NL universitaire bodem. Onmisbaar voor systematic reviews. Sterkste NL academische verankering."
Semantic Scholar,Academische zoekmachine,"Wetenschappelijke literatuur zoeken en analyseren via AI. 205M+ publicaties. Gratis open API.","7M+/maand","1.000+","Allen Institute for AI (non-profit). Onderliggende database voor ResearchRabbit / Connected Papers / SciSpace / Litmaps.",Ja,"Gepubliceerd op dl.acm.org en arXiv. Integreert Crossref, PubMed, Unpaywall. 2,5 miljard+ citatie-edges. Wordt geciteerd in honderden informatiewetenschappelijke papers.",Ja,Volledig gratis,"Non-profit. Geen commercieel verdienmodel op gebruikersdata. Open Athens.",semanticscholar.org,github.com/allenai/s2orc,Ja,"Basis van het academisch AI-zoekecosysteem. Non-profit. Grootste onderliggende databron."
Litmaps,Visuele literatuurkaart,"Citatienetwerken visualiseren en verwante papers ontdekken. 270M papers. Acquired ResearchRabbit mei 2025.","2M+","16.000+","Harvard, Stanford, Imperial College London, University of Cambridge",Ja,"University of Auckland case study gepubliceerd (2025). Deakin University library guide. $1M Series A mei 2025.",Ja,Gratis / premium,"Institutionele licenties met 75% educatieve korting.",litmaps.com,,Nee,"Overlappend met Connected Papers en ResearchRabbit. Sterke tool maar niet onderscheidend genoeg t.o.v. top 5."
ResearchRabbit,Literatuurontdekking,"Papers ontdekken via citatienetwerken en co-auteurschapskaarten. Zoekt gerelateerde werken.","1M+","50+","Deakin University, Fort Lewis College, University of Northampton",Nee,"Library guides bij 50+ universiteiten. Geen peer-reviewed evaluaties van de tool zelf gevonden. Overgenomen door Litmaps in mei 2025.",Ja,Gratis (nu freemium),"Basisgegevens niet naar externe servers.",researchrabbit.ai,,Nee,"Overgenomen door Litmaps. Minder onderscheidend dan top 5 alternatieven."
Connected Papers,Visualisatie citatienetwerk,"Papers verbonden door gelijkenis visualiseren, ook zonder directe citatie. Geschikt voor nieuwe velden verkennen.","Niet bekend","3+","Loyola Marymount University, University of Arizona, HKUST",Nee,"Library guides bij Loyola Marymount, Arizona, HKUST. Aanbevolen in Digital Orientalist (2025). Geen peer-reviewed evaluaties gevonden.",Ja,Gratis,"Geen gebruikersdata verkocht.",connectedpapers.com,,Nee,"Nuttige visualisatietool maar overlappend met Litmaps. Minder gebruikers en verankering dan top 5."
Inciteful,Netwerk-analyse literatuur,"Sleutelpublicaties en auteurs identificeren via citatienetwerk-analyse. 240M papers, 2 miljard citaties.","Niet bekend","1+","HKUST (library spotlight februari 2025)",Ja,"Gepubliceerd op ResearchGate: Citation Network-Based Research Discovery Using Inciteful. HKUST library featured tool 2025.",Ja,Gratis,"Geen account vereist. Geen data extern.",inciteful.xyz,,Nee,"Minder gebruikers en universitaire verankering dan top 5. Overlappend met Connected Papers."
SciSpace,Alles-in-één onderzoeksassistent,"Literatuur zoeken, papers uitleggen, schrijfassistent. 280M papers. Data uit Semantic Scholar en OpenAlex.","Niet bekend","Niet known","Universiteitsprogramma met gratis licenties voor studenten. Institutionele abonnementen beschikbaar.",Nee,"Capterra-beoordeeld. Geen peer-reviewed evaluaties van de tool zelf als onderzoekstool gevonden.",Ja,Gratis / €20 per maand,"Institutionele abonnementen beschikbaar.",scispace.com,,Nee,"Minder sterke academische verankering dan top 5. Overlappend met Elicit en Consensus."
NotebookLM,Document-analyse,"Tot 50 bronnen (PDF, links, video) analyseren en inzichten extraheren. Audio-samenvattingen genereren.","17M MAU","10.000+","Stanford (Workspace), Case Western Reserve, Arizona State, NYU, Northeastern",Ja,"ACM-publicatie (2025): Misalignment Problem in Education. NYU symposium oktober 2025. Tienduizenden instellingen na flashcard-launch september 2025.",Ja,Gratis (Google Workspace),"Google-eigendom. Privacyzorgen voor gevoelige of vertrouwelijke data.",notebooklm.google.com,,Nee,"Google-eigendom is privacyrisico. Zoekt niet zelfstandig in wetenschappelijke literatuur."
Perplexity AI,AI-zoekengine,"Vragen beantwoorden met geciteerde bronnen. Deep Research: 100+ bronnen synthetiseren in 4 minuten.","15M+ MAU","3+","Texas A&M, Texas State (pilot), Kogod School of Business / American University",Nee,"Wiley partnership. Campus Partner Program. Deep Research gelanceerd februari 2025. Geen peer-reviewed evaluaties als onderzoekstool.",Ja,Gratis / Pro,"Data verwerkt op Perplexity-servers.",perplexity.ai,,Nee,"Mixt wetenschappelijke en niet-wetenschappelijke bronnen. Minder gericht op peer-reviewed literatuur dan top 5."
Zotero,Referentiebeheer,"Bronnen opslaan, annoteren, organiseren en bibliografieën genereren in 9.000+ citatieformaten.","Breed universitair","500+","University of Michigan, UT Austin, Penn State, Caltech, American University",Ja,"Duizenden academische papers citeren Zotero als gebruikte referentiemanager. Open source, non-profit.",Ja,Gratis,"Open source, non-profit. Geen data verkoop. Lokale opslag mogelijk.",zotero.org,github.com/zotero/zotero,Nee,"Referentiebeheer, geen AI-zoekmachine. Aanvullend aan top 5 maar ander type tool."
OpenAlex,Open academische database,"Open alternatief voor Scopus / Web of Science. 477M+ werken. Gratis API voor data-analyse en bibliometrie.","1,5 miljard API-aanroepen/maand","5+","Leiden University (ranking 2024), Sorbonne University (vervangt Scopus). Frans Ministerie O&W (funder).",Ja,"Gepubliceerd op arXiv (2512.16434) en ScienceDirect (Journal of Informetrics 2026). Groter dan Scopus en Web of Science.",Ja,Volledig gratis,"Volledig open. Geen gebruikersdata.",openalex.org,github.com/ourresearch/openalex-api-tutorials,Nee,"Database / API voor ontwikkelaars en bibliometrici. Geen directe eindgebruikersinterface voor literatuurreview."
Iris.ai,Literatuurreview enterprise,"Grote volumes wetenschappelijke documenten en interne R&D-documenten verwerken. RAG-systemen bouwen.","Niet bekend","Niet bekend","Universiteitsbibliotheken via licenties. Gezamenlijke onderzoeksprojecten met universiteiten.",Nee,"Iris.ai 6.0 (2025). Wetenschappelijk getraind model. Geen peer-reviewed evaluaties als eindgebruikerstool gevonden.",Nee,Op aanvraag,"Verwerkingsovereenkomst beschikbaar. Veilige enterprise-omgeving.",iris.ai,,Nee,"Gericht op grote R&D-teams en enterprises. Minder direct inzetbaar voor een team als dat van Windesheim."
Paperpal,Academisch schrijfassistent,"Manuscripten redigeren, parafraseren, indieningscheck en plagiaatdetectie in één werkruimte.","1,5M+","Niet bekend","Universiteitslicentieprogramma voor faculteit en studenten. Pilots beschikbaar.",Nee,"Getraind op miljoenen wetenschappelijke artikelen en 23 jaar STM-expertise. Geen peer-reviewed evaluaties gevonden.",Ja,Gratis / €20 per maand,"Institutionele licenties beschikbaar.",paperpal.com,,Nee,"Schrijfassistent, geen literatuurzoektool. Aanvullend aan top 5 maar ander type tool."
SURF AI-hub / EduGenAI,Nederlandse AI-infrastructuur,"Veilig gebruik van LLMs (open-source en commercieel) via Nederlandse infrastructuur. Data blijft in Nederland.","Alle 14 NL universiteiten en hogescholen","14","Universiteit Twente (pilot), Universiteit Utrecht (pilot). Alle aangesloten SURF-instellingen.",Nee,"DPIA gepubliceerd en openbaar beschikbaar. Actieve pilots bij UT en UU. Breed beschikbaar eind 2026.",In pilotfase,Op aanvraag,"Data gegarandeerd in Nederland. DPIA gepubliceerd. Meest privacyveilige LLM-optie voor NL instellingen.",surf.nl,,Nee,"In pilotfase, nog niet breed beschikbaar. Vervangen door top 5 die nu al inzetbaar zijn."
Whisper (lokaal),Transcriptie,"Vergaderingen en interviews automatisch transcriberen zonder data naar externe servers te sturen. Open source model van OpenAI.","Niet bekend","1+","Universiteit Groningen (gratis voor alle medewerkers en studenten als lokale dienst).",Ja,"OpenAI arXiv-paper (2212.04356): Robust Speech Recognition via Large-Scale Weak Supervision. UGroningen lokale deployment.",Ja,Gratis,"Volledig lokaal draaien mogelijk. Geen data verlaat de server.",github.com/openai/whisper,github.com/openai/whisper,Nee,"Ander type tool (transcriptie, niet literatuurreview). Sterk aanvullend maar buiten scope top 5."
Mendeley,Referentiebeheer + PDF-reader,"Literatuur opslaan, annoteren, citeren. Ingebouwde PDF-reader en sociale netwerkfuncties voor onderzoekers.","6M+","500+","Breed universitair via Elsevier-institutionele toegang.",Ja,"Duizenden academische papers citeren Mendeley als gebruikte referentiemanager. Elsevier-eigendom.",Ja,Gratis basis,"Elsevier-eigendom. Data gebruikt voor Elsevier-diensten.",mendeley.com,,Nee,"Referentiebeheer, geen AI-zoekmachine. Elsevier-eigendom brengt commerciële dataafhankelijkheid."
Jenni.ai,Academisch schrijfassistent,"AI schrijfassistent voor papers, scripties en rapporten. Citatieintegratie en plagiaatcheck.","1M+","Niet bekend","Breed gebruikt bij universiteiten. Geen institutionele abonnementen beschikbaar.",Nee,"Geen peer-reviewed evaluaties van de tool gevonden.",Ja,Gratis basis / €20 per maand,"Data op Jenni-servers.",jenni.ai,,Nee,"Schrijfassistent, geen literatuurzoektool. Minder academische verankering dan top 5."
